{
  "sqlKey": "demo.test.complex.realWorldFragmentSystem#v1",
  "xmlPath": "/tests/fixtures/project/src/main/resources/com/example/mapper/test/complex_harness_mapper.xml",
  "namespace": "demo.test.complex",
  "statementId": "realWorldFragmentSystem",
  "statementType": "SELECT",
  "variantId": "v1",
  "sql": "SELECT u.id, u.name, u.email, u.status, u.created_at, u.updated_at, o.id, o.order_no, o.amount, o.status as order_status, o.created_at as order_date FROM users u LEFT JOIN orders o ON u.id = o.user_id WHERE u.status = #{userStatus} AND u.department_id IN (#{deptIds}) AND o.status = #{orderStatus} ORDER BY #{sortField} LIMIT #{limit}",
  "parameterMappings": [
    {"name": "userStatus", "type": "string"},
    {"name": "deptIds", "type": "list"},
    {"name": "orderStatus", "type": "string"},
    {"name": "sortField", "type": "string"},
    {"name": "limit", "type": "integer"}
  ],
  "paramExample": {"userStatus": "active", "deptIds": [1, 2], "orderStatus": "completed", "sortField": "name", "limit": 10},
  "locators": {"statementId": "realWorldFragmentSystem", "range": {"startLine": 267, "startColumn": 13, "endLine": 282, "endColumn": 16}},
  "riskFlags": ["DOLLAR_SUBSTITUTION"],
  "scanWarnings": null,
  "templateSql": "SELECT\n    <include refid=\"RWW_Cols_User\"/>,\n    <include refid=\"RWW_Cols_Order\"/>\nFROM users u\nLEFT JOIN orders o ON u.id = o.user_id\n<where>\n    <include refid=\"RWW_Filter_All\"/>\n</where>\n<if test=\"sortField != null\">\n    ORDER BY ${sortField}\n</if>\n<if test=\"limit != null\">\n    LIMIT #{limit}\n</if>",
  "dynamicFeatures": ["INCLUDE", "WHERE", "IF", "FOREACH", "DOLLAR_SUBSTITUTION", "LIMIT", "ORDER"],
  "includeTrace": ["RWW_Cols_User", "RWW_Cols_Order", "RWW_Filter_All", "RWW_Filter_User", "RWW_Filter_UserStatus", "RWW_Filter_UserDept", "RWW_Filter_OrderStatus"],
  "dynamicTrace": {"statementFeatures": ["INCLUDE", "WHERE", "IF", "FOREACH", "DOLLAR_SUBSTITUTION", "LIMIT", "ORDER"], "includeFragments": ["RWW_Cols_User", "RWW_Cols_Order", "RWW_Filter_All"]},
  "includeBindings": [],
  "templateTarget": "DYNAMIC_SQL",
  "primaryFragmentTarget": "FRAGMENT"
}