{
  "sqlKey": "demo.test.complex.jsonFunctionsWithDynamic#v1",
  "xmlPath": "/tests/fixtures/project/src/main/resources/com/example/mapper/test/complex_harness_mapper.xml",
  "namespace": "demo.test.complex",
  "statementId": "jsonFunctionsWithDynamic",
  "statementType": "SELECT",
  "variantId": "v1",
  "sql": "SELECT id, name, JSON_EXTRACT(metadata, #{jsonPath}) as extracted_value, JSON_CONTAINS(metadata, #{jsonSearch}, #{jsonKey}) as contains_flag, JSON_SEARCH(metadata, 'one', #{searchTerm}, NULL, #{jsonPath}) as search_result FROM users WHERE status IN (#{statusList}) AND metadata IS #{hasMetadata} NULL LIMIT #{limit}",
  "parameterMappings": [
    {"name": "jsonPath", "type": "string"},
    {"name": "jsonSearch", "type": "string"},
    {"name": "jsonKey", "type": "string"},
    {"name": "searchTerm", "type": "string"},
    {"name": "statusList", "type": "list"},
    {"name": "hasMetadata", "type": "boolean"},
    {"name": "limit", "type": "integer"}
  ],
  "paramExample": {"jsonPath": "$.profile.address", "jsonSearch": "{\"city\":\"Beijing\"}", "jsonKey": "$.profile", "searchTerm": "developer", "statusList": ["active"], "hasMetadata": true, "limit": 100},
  "locators": {"statementId": "jsonFunctionsWithDynamic", "range": {"startLine": 812, "startColumn": 5, "endLine": 834, "endColumn": 12}},
  "riskFlags": ["DOLLAR_SUBSTITUTION"],
  "scanWarnings": null,
  "templateSql": "SELECT\n    id, name,\n    JSON_EXTRACT(metadata, #{jsonPath}) as extracted_value,\n    JSON_CONTAINS(metadata, #{jsonSearch}, #{jsonKey}) as contains_flag,\n    JSON_SEARCH(metadata, 'one', #{searchTerm}, NULL, #{jsonPath}) as search_result\nFROM users\n<where>\n    <if test=\"statusList != null and statusList.size() > 0\">\n        AND status IN\n        <foreach collection=\"statusList\" item=\"s\" open=\"(\" separator=\",\" close=\")\">\n            #{s}\n        </foreach>\n    </if>\n    <if test=\"hasMetadata != null\">\n        AND metadata IS <if test=\"hasMetadata\">NOT</if> NULL\n    </if>\n</where>\n<if test=\"limit != null\">\n    LIMIT #{limit}\n</if>",
  "dynamicFeatures": ["WHERE", "IF", "FOREACH", "DOLLAR_SUBSTITUTION", "LIMIT"],
  "includeTrace": [],
  "dynamicTrace": {"statementFeatures": ["WHERE", "IF", "FOREACH", "DOLLAR_SUBSTITUTION", "LIMIT"], "includeFragments": []},
  "includeBindings": [],
  "templateTarget": "DYNAMIC_SQL",
  "primaryFragmentTarget": null
}