{
  "sqlKey": "demo.test.complex.whereForeachMultiColumn#v1",
  "xmlPath": "/tests/fixtures/project/src/main/resources/com/example/mapper/test/complex_harness_mapper.xml",
  "namespace": "demo.test.complex",
  "statementId": "whereForeachMultiColumn",
  "statementType": "SELECT",
  "variantId": "v1",
  "sql": "SELECT id, name FROM users WHERE (id, status) IN ((#{f.id}, #{f.status}))",
  "parameterMappings": [
    {"name": "filters", "type": "list"}
  ],
  "paramExample": {"filters": [{"id": 1, "status": "active"}, {"id": 2, "status": "pending"}]},
  "locators": {"statementId": "whereForeachMultiColumn", "range": {"startLine": 801, "startColumn": 13, "endLine": 809, "endColumn": 16}},
  "riskFlags": [],
  "scanWarnings": null,
  "templateSql": "SELECT id, name FROM users\n<where>\n    (id, status) IN\n    <foreach collection=\"filters\" item=\"f\" open=\"(\" separator=\",\" close=\")\">\n        (#{f.id}, #{f.status})\n    </foreach>\n</where>",
  "dynamicFeatures": ["WHERE", "FOREACH"],
  "includeTrace": [],
  "dynamicTrace": {"statementFeatures": ["WHERE", "FOREACH"], "includeFragments": []},
  "includeBindings": [],
  "templateTarget": "DYNAMIC_SQL",
  "primaryFragmentTarget": null
}