{
  "sqlKey": "demo.test.complex.ifForeachWithSort#v1",
  "xmlPath": "/tests/fixtures/project/src/main/resources/com/example/mapper/test/complex_harness_mapper.xml",
  "namespace": "demo.test.complex",
  "statementId": "ifForeachWithSort",
  "statementType": "SELECT",
  "variantId": "v1",
  "sql": "SELECT id, name, email FROM users WHERE status = #{status} ORDER BY #{sortFields}",
  "parameterMappings": [
    {"name": "status", "type": "string"},
    {"name": "sortFields", "type": "list"}
  ],
  "paramExample": {"status": "active", "sortFields": ["name", "created_at"]},
  "locators": {"statementId": "ifForeachWithSort", "range": {"startLine": 652, "startColumn": 13, "endLine": 665, "endColumn": 16}},
  "riskFlags": ["DOLLAR_SUBSTITUTION"],
  "scanWarnings": null,
  "templateSql": "SELECT id, name, email FROM users\n<where>\n    <if test=\"status != null\">\n        AND status = #{status}\n    </if>\n</where>\n<if test=\"sortFields != null and sortFields.size() > 0\">\n    ORDER BY\n    <foreach collection=\"sortFields\" item=\"field\" separator=\",\">\n        ${field}\n    </foreach>\n</if>",
  "dynamicFeatures": ["WHERE", "IF", "FOREACH", "DOLLAR_SUBSTITUTION"],
  "includeTrace": [],
  "dynamicTrace": {"statementFeatures": ["WHERE", "IF", "FOREACH", "DOLLAR_SUBSTITUTION"], "includeFragments": []},
  "includeBindings": [],
  "templateTarget": "DYNAMIC_SQL",
  "primaryFragmentTarget": null
}