{
  "sqlKey": "demo.test.complex.tripleNestedChoose#v1",
  "xmlPath": "/tests/fixtures/project/src/main/resources/com/example/mapper/test/complex_harness_mapper.xml",
  "namespace": "demo.test.complex",
  "statementId": "tripleNestedChoose",
  "statementType": "SELECT",
  "variantId": "v1",
  "sql": "SELECT id, name, status, department, title FROM users WHERE CASE WHEN #{role} = 'admin' THEN (CASE WHEN #{dept} IS NOT NULL THEN (CASE WHEN #{title} IS NOT NULL THEN department = #{dept} AND title = #{title} ELSE department = #{dept} END) ELSE 1=1 END) WHEN #{role} = 'manager' THEN (CASE WHEN #{status} IS NOT NULL THEN status = #{status} ELSE status = 'active' END) ELSE status = 'public' END",
  "parameterMappings": [
    {"name": "role", "type": "string"},
    {"name": "dept", "type": "string"},
    {"name": "title", "type": "string"},
    {"name": "status", "type": "string"}
  ],
  "paramExample": {"role": "admin", "dept": "Engineering", "title": "Engineer", "status": "active"},
  "locators": {"statementId": "tripleNestedChoose", "range": {"startLine": 1180, "startColumn": 13, "endLine": 1214, "endColumn": 16}},
  "riskFlags": [],
  "scanWarnings": null,
  "templateSql": "SELECT id, name, status, department, title FROM users\n<choose>\n    <when test=\"role == 'admin'\">\n        <choose>\n            <when test=\"dept != null\">\n                <choose>\n                    <when test=\"title != null\">\n                        WHERE department = #{dept} AND title = #{title}\n                    </when>\n                    <otherwise>\n                        WHERE department = #{dept}\n                    </otherwise>\n                </choose>\n            </when>\n            <otherwise>\n                WHERE 1=1\n            </otherwise>\n        </choose>\n    </when>\n    <when test=\"role == 'manager'\">\n        <choose>\n            <when test=\"status != null\">\n                WHERE status = #{status}\n            </when>\n            <otherwise>\n                WHERE status = 'active'\n            </otherwise>\n        </choose>\n    </when>\n    <otherwise>\n        WHERE status = 'public'\n    </otherwise>\n</choose>",
  "dynamicFeatures": ["CHOOSE", "WHEN", "IF"],
  "includeTrace": [],
  "dynamicTrace": {"statementFeatures": ["CHOOSE", "WHEN", "IF"], "includeFragments": []},
  "includeBindings": [],
  "templateTarget": "DYNAMIC_SQL",
  "primaryFragmentTarget": null
}