{
  "sqlKey": "demo.test.complex.includeIfWithLimit#v1",
  "xmlPath": "/tests/fixtures/project/src/main/resources/com/example/mapper/test/complex_harness_mapper.xml",
  "namespace": "demo.test.complex",
  "statementId": "includeIfWithLimit",
  "statementType": "SELECT",
  "variantId": "v1",
  "sql": "SELECT id, name, email FROM users WHERE status = #{status} LIMIT #{limit}",
  "parameterMappings": [
    {"name": "status", "type": "string"},
    {"name": "limit", "type": "integer"}
  ],
  "paramExample": {"status": "active", "limit": 10},
  "locators": {"statementId": "includeIfWithLimit", "range": {"startLine": 679, "startColumn": 13, "endLine": 687, "endColumn": 16}},
  "riskFlags": [],
  "scanWarnings": null,
  "templateSql": "SELECT <include refid=\"FilterColumns\"/> FROM users\n<if test=\"status != null\">\n    WHERE status = #{status}\n</if>\n<if test=\"limit != null\">\n    LIMIT #{limit}\n</if>",
  "dynamicFeatures": ["INCLUDE", "IF", "LIMIT"],
  "includeTrace": ["FilterColumns"],
  "dynamicTrace": {"statementFeatures": ["INCLUDE", "IF", "LIMIT"], "includeFragments": ["FilterColumns"]},
  "includeBindings": [],
  "templateTarget": "DYNAMIC_SQL",
  "primaryFragmentTarget": null
}