{
  "sqlKey": "demo.test.complex.complexAllFeatures#v1",
  "xmlPath": "/tests/fixtures/project/src/main/resources/com/example/mapper/test/complex_harness_mapper.xml",
  "namespace": "demo.test.complex",
  "statementId": "complexAllFeatures",
  "statementType": "SELECT",
  "variantId": "v1",
  "sql": "SELECT id, name, email, status, created_at FROM users WHERE status = #{status} AND name LIKE CONCAT('%', #{namePattern}, '%') AND id IN (#{ids[0]}, #{ids[1]}, ...) ORDER BY ${sortField} LIMIT #{limit}",
  "parameterMappings": [
    {"name": "status", "type": "string"},
    {"name": "namePattern", "type": "string"},
    {"name": "ids", "type": "List<Long>"},
    {"name": "sortField", "type": "string"},
    {"name": "limit", "type": "int"}
  ],
  "paramExample": {"status": "active", "namePattern": "John", "ids": [1, 2, 3], "sortField": "created_at", "limit": 100},
  "locators": {"statementId": "complexAllFeatures", "range": {"startLine": 238, "startColumn": 13, "endLine": 259, "endColumn": 16}},
  "riskFlags": ["DOLLAR_SUBSTITUTION"],
  "scanWarnings": null,
  "templateSql": "SELECT <include refid=\"BaseColumns\"/> FROM users\n<where>\n    <if test=\"status != null\">\n        AND status = #{status}\n    </if>\n    <if test=\"namePattern != null\">\n        AND name LIKE CONCAT('%', #{namePattern}, '%')\n    </if>\n    <if test=\"ids != null and ids.size() > 0\">\n        AND id IN\n        <foreach collection=\"ids\" item=\"id\" open=\"(\" separator=\",\" close=\")\">\n            #{id}\n        </foreach>\n    </if>\n</where>\n<if test=\"sortField != null\">\n    ORDER BY ${sortField}\n</if>\n<if test=\"limit != null\">\n    LIMIT #{limit}\n</if>",
  "dynamicFeatures": ["INCLUDE", "WHERE", "IF", "FOREACH", "DOLLAR_SUBSTITUTION"],
  "includeTrace": ["demo.test.complex.BaseColumns"],
  "dynamicTrace": {
    "statementFeatures": ["INCLUDE", "WHERE", "IF", "FOREACH", "DOLLAR_SUBSTITUTION"],
    "includeFragments": [{"ref": "demo.test.complex.BaseColumns", "dynamicFeatures": []}]
  },
  "includeBindings": [],
  "templateTarget": "DYNAMIC_SQL",
  "primaryFragmentTarget": "complex_harness_mapper.xml::demo.test.complex.BaseColumns"
}