[
  {
    "sqlKey": "com.example.UserMapper.findById",
    "xmlPath": "/mappers/UserMapper.xml",
    "namespace": "com.example",
    "statementId": "findById",
    "statementType": "SELECT",
    "variantId": "v1",
    "sql": "SELECT * FROM users WHERE id = #{id}",
    "parameterMappings": [],
    "paramExample": { "id": 1 },
    "locators": { "statementId": "findById" },
    "riskFlags": [],
    "dynamicFeatures": [],
    "templateSql": "SELECT * FROM users WHERE id = #{id}",
    "includeTrace": [],
    "dynamicTrace": null
  },
  {
    "sqlKey": "com.example.UserMapper.searchUsers",
    "xmlPath": "/mappers/UserMapper.xml",
    "namespace": "com.example",
    "statementId": "searchUsers",
    "statementType": "SELECT",
    "variantId": "v1",
    "sql": "SELECT * FROM users WHERE name LIKE #{name} AND status = #{status}",
    "parameterMappings": [],
    "paramExample": { "name": "%john%", "status": "active" },
    "locators": { "statementId": "searchUsers" },
    "riskFlags": ["PREFIX_WILDCARD"],
    "dynamicFeatures": ["IF"],
    "templateSql": "SELECT * FROM users WHERE name LIKE #{name} AND status = #{status}",
    "includeTrace": [],
    "dynamicTrace": null
  },
  {
    "sqlKey": "com.example.OrderMapper.findByCondition",
    "xmlPath": "/mappers/OrderMapper.xml",
    "namespace": "com.example",
    "statementId": "findByCondition",
    "statementType": "SELECT",
    "variantId": "v1",
    "sql": "SELECT * FROM orders WHERE created_at > #{startDate}",
    "parameterMappings": [],
    "paramExample": { "startDate": "2024-01-01" },
    "locators": { "statementId": "findByCondition" },
    "riskFlags": [],
    "dynamicFeatures": ["WHERE"],
    "templateSql": "SELECT * FROM orders WHERE created_at > #{startDate}",
    "includeTrace": [],
    "dynamicTrace": null
  },
  {
    "sqlKey": "com.example.ProductMapper.search",
    "xmlPath": "/mappers/ProductMapper.xml",
    "namespace": "com.example",
    "statementId": "search",
    "statementType": "SELECT",
    "variantId": "v1",
    "sql": "SELECT * FROM products WHERE UPPER(name) LIKE #{keyword}",
    "parameterMappings": [],
    "paramExample": { "keyword": "% electronics %" },
    "locators": { "statementId": "search" },
    "riskFlags": ["FUNCTION_WRAP", "PREFIX_WILDCARD"],
    "dynamicFeatures": ["IF"],
    "templateSql": "SELECT * FROM products WHERE UPPER(name) LIKE #{keyword}",
    "includeTrace": [],
    "dynamicTrace": null
  }
]
