{
  "sqlKey": "demo.test.complex.havingWithDynamic#v1",
  "xmlPath": "/tests/fixtures/project/src/main/resources/com/example/mapper/test/complex_harness_mapper.xml",
  "namespace": "demo.test.complex",
  "statementId": "havingWithDynamic",
  "statementType": "SELECT",
  "variantId": "v1",
  "sql": "SELECT department, COUNT(*) as user_count, SUM(amount) as total_amount FROM users u LEFT JOIN orders o ON u.id = o.user_id WHERE u.status = #{status} AND o.created_at >= #{startDate} GROUP BY department HAVING COUNT(*) >= #{minCount} HAVING SUM(amount) >= #{minAmount}",
  "parameterMappings": [
    {"name": "status", "type": "string"},
    {"name": "startDate", "type": "date"},
    {"name": "minCount", "type": "integer"},
    {"name": "minAmount", "type": "bigdecimal"}
  ],
  "paramExample": {"status": "active", "startDate": "2024-01-01", "minCount": 5, "minAmount": 1000},
  "locators": {"statementId": "havingWithDynamic", "range": {"startLine": 327, "startColumn": 13, "endLine": 346, "endColumn": 16}},
  "riskFlags": [],
  "scanWarnings": null,
  "templateSql": "SELECT department, COUNT(*) as user_count, SUM(amount) as total_amount\nFROM users u\nLEFT JOIN orders o ON u.id = o.user_id\n<where>\n    <if test=\"status != null\">\n        AND u.status = #{status}\n    </if>\n    <if test=\"startDate != null\">\n        AND o.created_at &gt;= #{startDate}\n    </if>\n</where>\nGROUP BY department\n<if test=\"minCount != null\">\n    HAVING COUNT(*) &gt;= #{minCount}\n</if>\n<if test=\"minAmount != null\">\n    HAVING SUM(amount) &gt;= #{minAmount}\n</if>",
  "dynamicFeatures": ["WHERE", "IF", "GROUP"],
  "includeTrace": [],
  "dynamicTrace": {"statementFeatures": ["WHERE", "IF", "GROUP"], "includeFragments": []},
  "includeBindings": [],
  "templateTarget": "DYNAMIC_SQL",
  "primaryFragmentTarget": null
}