{
  "sqlKey": "demo.test.complex.staticSimpleSelect#v1",
  "xmlPath": "/tests/fixtures/project/src/main/resources/com/example/mapper/test/complex_harness_mapper.xml",
  "namespace": "demo.test.complex",
  "statementId": "staticSimpleSelect",
  "statementType": "SELECT",
  "variantId": "v1",
  "sql": "SELECT id, name, email FROM users WHERE id = #{id}",
  "parameterMappings": [{"name": "id", "type": "long"}],
  "paramExample": {"id": 1},
  "locators": {"statementId": "staticSimpleSelect", "range": {"startLine": 30, "startColumn": 13, "endLine": 32, "endColumn": 16}},
  "riskFlags": [],
  "scanWarnings": null,
  "templateSql": "SELECT id, name, email FROM users WHERE id = #{id}",
  "dynamicFeatures": [],
  "includeTrace": [],
  "dynamicTrace": {"statementFeatures": [], "includeFragments": []},
  "includeBindings": [],
  "templateTarget": "STATIC_SQL",
  "primaryFragmentTarget": null
}